365 DataScience RE California Database,,
Histograms. Graphing numerical data,,
,,
"Task 2: Create a frequency distribution graph representing the price (that is a histogram with the highest possible number of bins - 272). Use data on all apartments and offices, no matter if sold or not.",,
"Task 3: Create a histogram which represents the Price variable. Choose interval width (bins) of length $100,000. If you don't know how to do that, refer to the Course notes on descriptive statistics provided with the first lecture in this section.",,
"              Use the data on all properties, no matter if sold or not.",,
Task 4: Interpret the results.,,"Most of the properties are concentrated in the interval ($21,564.07 to 317,564.07)"
,,
